{
  "artifact_set_digest": "sha256:3fe6668d03e48dcd2c927fafa24f3ebe0136c46b1e0514073046369718a35692",
  "artifacts": [
    {
      "digest": "sha256:c64d07b5aa8927ed9e6b6f808b3cf3987c9d3f5c752c9288f0e25cb558392e93",
      "path": "contracts.v4.json",
      "role": "contract_catalog"
    },
    {
      "digest": "sha256:b0debfb53b05a5c604f86e40a106cbda54c607abcf6cabc401b558476d7af481",
      "path": "executables.v4.json",
      "role": "sidecar"
    },
    {
      "digest": "sha256:4b3d6f2ad2d054cdcf7f3c6b5ebfecd19d14c8f9b926572860efb2ca212b3b81",
      "path": "pack.v4.json",
      "role": "canonical_manifest"
    }
  ],
  "index_api_version": "io.tobkiri.pack-artifact-index.v4",
  "integrity_seal": {
    "algorithm": "sha256-canonical-v1",
    "signed_digest": "sha256:3d6e75add758ae90ec1b01caab5d593998a57f0744332db51becfff23d9869eb"
  },
  "pack_id": "rumi_evidence_dossier_pack",
  "source_identity": "sha256:ce1aaebd980f8e10393c110843a30853efba40cfbb845a9fa5250c356173ac9e"
}
