{
  "artifact_set_digest": "sha256:3346b756f5b92b6f09b2d6cffd2cbe07ec932c5906f0bb175d66736582a15027",
  "artifacts": [
    {
      "digest": "sha256:3db4e708ccac4196aa2fbc61e74e136a5c08149e2326cb3ded14541e68344791",
      "path": "contracts.v4.json",
      "role": "contract_catalog"
    },
    {
      "digest": "sha256:fa8fc88191184b3ff6906ce0bcbae4e94e6834d2337a0cd938aff4710516332a",
      "path": "executables.v4.json",
      "role": "sidecar"
    },
    {
      "digest": "sha256:243a8ebe8ace2f6aca9051dd37b4617a3d65e79e77369458721c23c167e261d0",
      "path": "pack.v4.json",
      "role": "canonical_manifest"
    }
  ],
  "index_api_version": "io.tobkiri.pack-artifact-index.v4",
  "integrity_seal": {
    "algorithm": "sha256-canonical-v1",
    "signed_digest": "sha256:bfe1dcf40ac1acb5781408e09aae6d47d09ee19c59fdbcabbb6fccadfa8d7523"
  },
  "pack_id": "rumi_code_migration_pack",
  "source_identity": "sha256:510147147eca49e7b478e50ad37a4a0fbb914c0540df66ee00a69ce7f247c3d5"
}
