{
  "artifact_set_digest": "sha256:35116e9a053f8e9c9f163f44e4331dfcba99294ac09bf37dfabe8126eef845ce",
  "artifacts": [
    {
      "digest": "sha256:ef17a4685b32a4362d0a65e80919ea0651d5be51fd4c22555538e6b36eabe76b",
      "path": "contracts.v4.json",
      "role": "contract_catalog"
    },
    {
      "digest": "sha256:66e2d8dff6067ba3dae2711388aa9dd7953a4f74405f60f56ddda065becb4021",
      "path": "executables.v4.json",
      "role": "sidecar"
    },
    {
      "digest": "sha256:73debdc478e2d620809f29e090d61352348601a961870ce2e3cecf9e821b9b08",
      "path": "pack.v4.json",
      "role": "canonical_manifest"
    }
  ],
  "index_api_version": "io.tobkiri.pack-artifact-index.v4",
  "integrity_seal": {
    "algorithm": "sha256-canonical-v1",
    "signed_digest": "sha256:b150d410fdef916ba56c3475ee7e83324b7e62d626cf31a8cb207ba51aaab710"
  },
  "pack_id": "rumi_agent_services_pack",
  "source_identity": "sha256:6f0a0246a15d21299a01c04aa4172f8591415e075fdad23fca2f9b38e0d90c3a"
}
