{
  "artifact_set_digest": "sha256:217ef40abcd3c14cf29aa7b7b17cb473062235a0e5b7f0c901e1f8f27669e95a",
  "artifacts": [
    {
      "digest": "sha256:d03189906385ed65ef8cc67b121f85b057158e6fe3ebb9c8ef4d7339693765b8",
      "path": "contracts.v4.json",
      "role": "contract_catalog"
    },
    {
      "digest": "sha256:9f998fa0ef0703f42d3feb04afa5c8442c3e65abb597187c5d93330cc4ea1a5a",
      "path": "executables.v4.json",
      "role": "sidecar"
    },
    {
      "digest": "sha256:fd678b657fca818bc75cbc281d2a32674b0f5e335dce8d3f20c53fe860150c83",
      "path": "pack.v4.json",
      "role": "canonical_manifest"
    },
    {
      "digest": "sha256:444f5415acce534f5b8a2f9eef0340eeef9c58d5394ee712275ca5ef89333042",
      "path": "runtime/runner.py",
      "role": "runtime"
    },
    {
      "digest": "sha256:6deac49d83afd1cb8e2fa1f7754d7ae14a25717ab5873ce9a1992b2c1208f58d",
      "path": "runtime/service.py",
      "role": "runtime"
    }
  ],
  "index_api_version": "io.tobkiri.pack-artifact-index.v4",
  "integrity_seal": {
    "algorithm": "sha256-canonical-v1",
    "signed_digest": "sha256:2295529a0c94008e699813886f3d3f87aa17c9bb0a60427043209083e7b6fca2"
  },
  "pack_id": "rumi_clipboard_host_service_pack",
  "source_identity": "sha256:93a5ee1a5af733a0558404dd7f0b2e5d5159fdaecc7f09c1c579f58d904ca57f"
}
