{
  "artifact_set_digest": "sha256:d93bef49391cc124728ad86e90be28077aecca15a75a4c3b71d630e1fe4485fd",
  "artifacts": [
    {
      "digest": "sha256:0cd4f1b0d9907c95c98000bea39d54d6d567ff9c4b9f759316a78b79ce5fc948",
      "path": "contracts.v4.json",
      "role": "contract_catalog"
    },
    {
      "digest": "sha256:cea1f9273f3f6a6a2b9f6016450a896c0b8b3f06d7ad357b422200a0a810458b",
      "path": "executables.v4.json",
      "role": "sidecar"
    },
    {
      "digest": "sha256:d02b9738d56234edbb41c1a97bd9a49b1eae663d371a360c975e95900e3ec43a",
      "path": "pack.v4.json",
      "role": "canonical_manifest"
    },
    {
      "digest": "sha256:e791852be8e726c6fb26f992d1e59f7654cbff9648336c672228616aa9e769fd",
      "path": "runtime/clock.py",
      "role": "runtime"
    },
    {
      "digest": "sha256:1cc29b054d67189967d350cda6a834100a5445b446f60cce42694aff0af27dac",
      "path": "runtime/scheduler.py",
      "role": "runtime"
    }
  ],
  "index_api_version": "io.tobkiri.pack-artifact-index.v4",
  "integrity_seal": {
    "algorithm": "sha256-canonical-v1",
    "signed_digest": "sha256:72d6de7f55cd4ea1c3135d1d1e2e711aec1126d1c1a3dc4434b9deaaa39e651f"
  },
  "pack_id": "rumi_scheduler_runtime_pack",
  "source_identity": "sha256:70e1aa66a1ff9e1b97c9fa62a02aedf6316b3f271d1f49246688535fbe8970c4"
}
