{
  "artifact_set_digest": "sha256:71886d6c72ce2adc90ced40cc1da740a8466236987cf1c591b00274954112d0b",
  "artifacts": [
    {
      "digest": "sha256:8d7e3f2be8916dbd38a32a261a5942127ec1c11acdb2c3e0f0662f2674ff7a53",
      "path": "contracts.v4.json",
      "role": "contract_catalog"
    },
    {
      "digest": "sha256:f62b3056f08814a7f8db80950072ebd115af3b71ef669a22a6ffce19caf53acf",
      "path": "executables.v4.json",
      "role": "sidecar"
    },
    {
      "digest": "sha256:52cd139f32123766c2bc057ffac853f98d4a67190609d3b87997d45bdf13241e",
      "path": "pack.v4.json",
      "role": "canonical_manifest"
    }
  ],
  "index_api_version": "io.tobkiri.pack-artifact-index.v4",
  "integrity_seal": {
    "algorithm": "sha256-canonical-v1",
    "signed_digest": "sha256:5394d7d16e55c6563f8c3a9e27063bb3f8221d10159e30d8f65ca6f5f4324016"
  },
  "pack_id": "rumi_meeting_intelligence_pack",
  "source_identity": "sha256:35a746d23770e95302397587eaef1a0c9ba2258ffaaa5f0c7193a155ccf5ac04"
}
