{
  "artifact_set_digest": "sha256:f6beabe38d4bfd3d2ea484ee45250c87b82338c03d2bf9e74f9681927e2aca99",
  "artifacts": [
    {
      "digest": "sha256:32cd7ff1d73bce90c311e2fa65bea114342cf883c78cb04ac944ef7f7ab66551",
      "path": "contracts.v4.json",
      "role": "contract_catalog"
    },
    {
      "digest": "sha256:f47e29ddf2e12cc42899da57f9219efeb12eb423009899dcfc7eba3c22ff74af",
      "path": "executables.v4.json",
      "role": "sidecar"
    },
    {
      "digest": "sha256:92ef9c73a3abf36874e1eda3012cce475da86bb9ef32b479d9d3b9c72b053cb7",
      "path": "pack.v4.json",
      "role": "canonical_manifest"
    }
  ],
  "index_api_version": "io.tobkiri.pack-artifact-index.v4",
  "integrity_seal": {
    "algorithm": "sha256-canonical-v1",
    "signed_digest": "sha256:3a8f4ba190a24c3d416b8041b13be58b95c3c132fcd9b368c5a4019ff15270aa"
  },
  "pack_id": "rumi_browser_element_pack",
  "source_identity": "sha256:3bc48ab7173dbe20c57943dbf22a444aa80f7bee92a0be54a371f81876992ee1"
}
